{
  "snapshot_type": "review",
  "schema_version": "1.1",
  "model_version": "review-1.1",
  "skill_version": "1.12.0",
  "rule_version": "1.12.0",
  "validator_version": "1.1.0",
  "security": {
    "name": "範例公司（合成資料，非真實標的）",
    "symbol": "EXAMPLE",
    "exchange": "TWSE",
    "instrument": "ordinary",
    "currency": "TWD"
  },
  "analysis_at": "2026-10-08T18:00:00+08:00",
  "data_cutoff_at": "2026-10-08T13:30:00+08:00",
  "mode": "research",
  "research_reference": {
    "reference": "attachment:snapshot.example.json",
    "sha256": "5b71ccf7f92d2443c0a46d017e79f22114b2bf58de7494a86c659f9adaa91b0a",
    "rule_version": "1.12.0",
    "model_version": "1.3"
  },
  "decision_reference": null,
  "tasks": [
    {
      "id": "quote",
      "status": "obtained",
      "reason": "合成示例：已核對該任務所需期間與口徑，非真實取數",
      "attempts": [
        {
          "stage": "primary",
          "source_url": "https://example.invalid/sample-source",
          "at": "2026-10-08T18:00:00+08:00",
          "request": "合成原文核對：quote",
          "result": "success",
          "detail": "合成資料；正式執行全部替換為實際紀錄",
          "authority_basis": "合成公司官方文件，非真實來源"
        }
      ]
    },
    {
      "id": "financials",
      "status": "obtained",
      "reason": "合成示例：已核對該任務所需期間與口徑，非真實取數",
      "attempts": [
        {
          "stage": "primary",
          "source_url": "https://example.invalid/sample-source",
          "at": "2026-10-08T18:00:00+08:00",
          "request": "合成原文核對：financials",
          "result": "success",
          "detail": "合成資料；正式執行全部替換為實際紀錄",
          "authority_basis": "合成公司官方文件，非真實來源"
        }
      ]
    },
    {
      "id": "valuation",
      "status": "obtained",
      "reason": "合成示例：已核對該任務所需期間與口徑，非真實取數",
      "attempts": [
        {
          "stage": "primary",
          "source_url": "https://example.invalid/sample-source",
          "at": "2026-10-08T18:00:00+08:00",
          "request": "合成原文核對：valuation",
          "result": "success",
          "detail": "合成資料；正式執行全部替換為實際紀錄",
          "authority_basis": "合成公司官方文件，非真實來源"
        }
      ]
    },
    {
      "id": "events",
      "status": "obtained",
      "reason": "合成示例：已核對該任務所需期間與口徑，非真實取數",
      "attempts": [
        {
          "stage": "primary",
          "source_url": "https://example.invalid/sample-source",
          "at": "2026-10-08T18:00:00+08:00",
          "request": "合成原文核對：events",
          "result": "success",
          "detail": "合成資料；正式執行全部替換為實際紀錄",
          "authority_basis": "合成公司官方文件，非真實來源"
        }
      ]
    },
    {
      "id": "growth",
      "status": "obtained",
      "reason": "合成示例：已核對該任務所需期間與口徑，非真實取數",
      "attempts": [
        {
          "stage": "primary",
          "source_url": "https://example.invalid/sample-source",
          "at": "2026-10-08T18:00:00+08:00",
          "request": "合成原文核對：growth",
          "result": "success",
          "detail": "合成資料；正式執行全部替換為實際紀錄",
          "authority_basis": "合成公司官方文件，非真實來源"
        }
      ]
    },
    {
      "id": "industry",
      "status": "obtained",
      "reason": "合成示例：已核對該任務所需期間與口徑，非真實取數",
      "attempts": [
        {
          "stage": "primary",
          "source_url": "https://example.invalid/sample-source",
          "at": "2026-10-08T18:00:00+08:00",
          "request": "合成原文核對：industry",
          "result": "success",
          "detail": "合成資料；正式執行全部替換為實際紀錄",
          "authority_basis": "合成公司官方文件，非真實來源"
        }
      ]
    }
  ],
  "sources": [],
  "assessment": {
    "workflow_status": "complete",
    "evidence_status": "sufficient",
    "pending_tasks": [],
    "unresolved_tasks": [],
    "waiting_reasons": [],
    "research_confidence": "high",
    "primary_source_count": 1,
    "alternative_source_count": 0,
    "attempt_count": 6,
    "claim_audit": {
      "status": "complete",
      "claims": 34,
      "unresolved_claims": [],
      "material_unresolved": [],
      "thesis_status": "established"
    }
  },
  "evidence_audit": {
    "status": "complete",
    "thesis_status": "established",
    "coverage_note": "合成範例逐項盤點結構化數值與分數，正文主張仍需人工盤點，非真實取數紀錄",
    "claims": [
      {
        "id": "metric_price",
        "kind": "fact",
        "statement": "合成查核：research:/metrics/price/value",
        "value": 100,
        "unit": "TWD/share",
        "period": "2026-10-08 synthetic close",
        "basis": "範例數值，非真實行情；寫口徑與來源限制",
        "targets": [
          "research:/metrics/price/value"
        ],
        "report_excerpt": "",
        "material": true,
        "verdict": "supported",
        "sources": [
          {
            "url": "https://example.invalid/sample-source",
            "locator": "合成附件表格之對應列",
            "published_at": "2026-07-30",
            "period": "2026-10-08 synthetic close",
            "basis": "範例數值，非真實行情；寫口徑與來源限制",
            "value": 100,
            "rank": "primary",
            "retrieval": "document"
          }
        ],
        "selected_source": 0,
        "premises": [],
        "calculation": null,
        "reason": "合成作者核對紀錄；不表示外部數據已查證"
      },
      {
        "id": "metric_market_cap",
        "kind": "fact",
        "statement": "合成查核：research:/metrics/market_cap/value",
        "value": 100000000,
        "unit": "TWD",
        "period": "2026 synthetic matching period",
        "basis": "範例數值，非真實行情；寫口徑與來源限制",
        "targets": [
          "research:/metrics/market_cap/value"
        ],
        "report_excerpt": "",
        "material": true,
        "verdict": "supported",
        "sources": [
          {
            "url": "https://example.invalid/sample-source",
            "locator": "合成附件表格之對應列",
            "published_at": "2026-07-30",
            "period": "2026 synthetic matching period",
            "basis": "範例數值，非真實行情；寫口徑與來源限制",
            "value": 100000000,
            "rank": "primary",
            "retrieval": "document"
          }
        ],
        "selected_source": 0,
        "premises": [],
        "calculation": null,
        "reason": "合成作者核對紀錄；不表示外部數據已查證"
      },
      {
        "id": "metric_eps_ttm",
        "kind": "fact",
        "statement": "合成查核：research:/metrics/eps_ttm/value",
        "value": 5,
        "unit": "TWD/share",
        "period": "2026 synthetic matching period",
        "basis": "範例數值，非真實行情；寫口徑與來源限制",
        "targets": [
          "research:/metrics/eps_ttm/value"
        ],
        "report_excerpt": "",
        "material": true,
        "verdict": "supported",
        "sources": [
          {
            "url": "https://example.invalid/sample-source",
            "locator": "合成附件表格之對應列",
            "published_at": "2026-07-30",
            "period": "2026 synthetic matching period",
            "basis": "範例數值，非真實行情；寫口徑與來源限制",
            "value": 5,
            "rank": "primary",
            "retrieval": "document"
          }
        ],
        "selected_source": 0,
        "premises": [],
        "calculation": null,
        "reason": "合成作者核對紀錄；不表示外部數據已查證"
      },
      {
        "id": "metric_pe_ttm",
        "kind": "calculation",
        "statement": "合成查核：research:/metrics/pe_ttm/value",
        "value": 20,
        "unit": "multiple",
        "period": "2026 synthetic matching period",
        "basis": "範例數值，非真實行情；寫口徑與來源限制",
        "targets": [
          "research:/metrics/pe_ttm/value"
        ],
        "report_excerpt": "",
        "material": true,
        "verdict": "supported",
        "sources": [],
        "selected_source": null,
        "premises": [
          "metric_price",
          "metric_eps_ttm"
        ],
        "calculation": {
          "method": "divide",
          "inputs": [
            100,
            5
          ],
          "reason": "同幣別每股價格除以同期EPS"
        },
        "reason": "合成作者核對紀錄；不表示外部數據已查證"
      },
      {
        "id": "metric_revenue_growth_q2",
        "kind": "fact",
        "statement": "合成查核：research:/metrics/revenue_growth_q2/value",
        "value": 20,
        "unit": "percent",
        "period": "2026 synthetic matching period",
        "basis": "範例數值，非真實行情；寫口徑與來源限制",
        "targets": [
          "research:/metrics/revenue_growth_q2/value"
        ],
        "report_excerpt": "",
        "material": true,
        "verdict": "supported",
        "sources": [
          {
            "url": "https://example.invalid/sample-source",
            "locator": "合成附件表格之對應列",
            "published_at": "2026-07-30",
            "period": "2026 synthetic matching period",
            "basis": "範例數值，非真實行情；寫口徑與來源限制",
            "value": 20,
            "rank": "primary",
            "retrieval": "document"
          }
        ],
        "selected_source": 0,
        "premises": [],
        "calculation": null,
        "reason": "合成作者核對紀錄；不表示外部數據已查證"
      },
      {
        "id": "metric_eps_growth_q2",
        "kind": "fact",
        "statement": "合成查核：research:/metrics/eps_growth_q2/value",
        "value": 40,
        "unit": "percent",
        "period": "2026 synthetic matching period",
        "basis": "範例數值，非真實行情；寫口徑與來源限制",
        "targets": [
          "research:/metrics/eps_growth_q2/value"
        ],
        "report_excerpt": "",
        "material": true,
        "verdict": "supported",
        "sources": [
          {
            "url": "https://example.invalid/sample-source",
            "locator": "合成附件表格之對應列",
            "published_at": "2026-07-30",
            "period": "2026 synthetic matching period",
            "basis": "範例數值，非真實行情；寫口徑與來源限制",
            "value": 40,
            "rank": "primary",
            "retrieval": "document"
          }
        ],
        "selected_source": 0,
        "premises": [],
        "calculation": null,
        "reason": "合成作者核對紀錄；不表示外部數據已查證"
      },
      {
        "id": "metric_roe_ttm",
        "kind": "fact",
        "statement": "合成查核：research:/metrics/roe_ttm/value",
        "value": 18,
        "unit": "percent",
        "period": "2026 synthetic matching period",
        "basis": "範例數值，非真實行情；寫口徑與來源限制",
        "targets": [